index,title,author,school,sentence_str,original_publication_date,sentences,word.count,anger,anticipation,disgust,fear,joy,sadness,surprise,trust,negative,positive
1169,Meditations,Marcus Aurelius,stoicism,"that whatsoever thou doest, shall turn to the furtherance of his own counsels, and resolutions.",170,that whatsoever thou doest shall turn to the furtherance of his own counsels and resolutions,15,0,0,0,0,0,0,0,0,0,0
1170,Meditations,Marcus Aurelius,stoicism,"But be not thou for shame such a part of the whole, as that vile and ridiculous verse (which Chrysippus in a place doth mention) is a part of the comedy.",170,but be not thou for shame such part of the whole as that vile and ridiculous verse which chrysippus in place doth mention is part of the comedy,28,0.035701535,0,0.07140307,0.035701535,0,0.035701535,0,0,0.07140307,0
1171,Meditations,Marcus Aurelius,stoicism,Doth either the sun take upon him to do that which belongs to the rain?,170,doth either the sun take upon him to do that which belongs to the rain,15,0,0.066622252,0,0,0.066622252,0,0.066622252,0.066622252,0,0.066622252
1172,Meditations,Marcus Aurelius,stoicism,or his son Aesculapius,170,or his son aesculapius,4,0,0,0,0,0,0,0,0,0,0
1173,Meditations,Marcus Aurelius,stoicism,"that, which unto the earth doth properly belong?",170,that which unto the earth doth properly belong,8,0,0,0,0,0,0,0,0,0,0
1174,Meditations,Marcus Aurelius,stoicism,How is it with every one of the stars in particular?,170,how is it with every one of the stars in particular,11,0,0,0,0,0,0,0,0,0,0
1175,Meditations,Marcus Aurelius,stoicism,"Though they all differ one from another, and have their several charges and functions by themselves, do they not all nevertheless concur and co operate to one end?.",170,though they all differ one from another and have their several charges and functions by themselves do they not all nevertheless concur and co operate to one end,28,0,0,0,0,0,0,0,0,0,0
1176,Meditations,Marcus Aurelius,stoicism,"If so be that the Gods have deliberated in particular of those things that should happen unto me, I must stand to their deliberation, as discrete and wise.",170,if so be that the gods have deliberated in particular of those things that should happen unto me must stand to their deliberation as discrete and wise,27,0,0.037023325,0,0,0,0,0,0,0,0.037023325
1177,Meditations,Marcus Aurelius,stoicism,"For that a God should be an imprudent God, is a thing hard even to conceive: and why should they resolve to do me hurt?",170,for that god should be an imprudent god is thing hard even to conceive and why should they resolve to do me hurt,23,0.043459365,0.043459365,0,0.086918731,0.043459365,0.086918731,0,0.043459365,0.086918731,0.043459365
1178,Meditations,Marcus Aurelius,stoicism,for what profit either unto them or the universe (which they specially take care for) could arise from it?,170,for what profit either unto them or the universe which they specially take care for could arise from it,19,0,0,0,0,0,0,0,0,0,0
1179,Meditations,Marcus Aurelius,stoicism,"But if so be that they have not deliberated of me in particular, certainly they have of the whole in general, and those things which in consequence and coherence of this general deliberation happen unto me in particular",170,but if so be that they have not deliberated of me in particular certainly they have of the whole in general and those things which in consequence and coherence of this general deliberation happen unto me in particular,38,0,0.026308866,0,0,0,0,0,0.026308866,0,0.052617732
1180,Meditations,Marcus Aurelius,stoicism,", I am bound to embrace and accept of.",170,am bound to embrace and accept of,7,0,0.142653352,0,0,0.142653352,0,0.142653352,0.142653352,0.142653352,0.142653352
1181,Meditations,Marcus Aurelius,stoicism,"But if so be that they have not deliberated at all (which indeed is very irreligious for any man to believe: for then let us neither sacrifice, nor pray, nor respect our oaths, neither let us any more use any of those things, which we persuaded of the presence and secret conversation of the Gods among us, daily use and practise:)",170,but if so be that they have not deliberated at all which indeed is very irreligious for any man to believe for then let us neither sacrifice nor pray nor respect our oaths neither let us any more use any of those things which we persuaded of the presence and secret conversation of the gods among us daily use and practise,61,0,0.065563022,0,0.016390756,0.032781511,0,0.016390756,0.049172267,0,0.065563022
1182,Meditations,Marcus Aurelius,stoicism,"but, I say, if so be that they have not indeed either in general, or particular deliberated of any of those things, that happen unto us in this world; yet God be thanked, that of those things that concern myself, it is lawful for me to deliberate myself, and all my deliberation is but concerning that",170,but say if so be that they have not indeed either in general or particular deliberated of any of those things that happen unto us in this world yet god be thanked that of those things that concern myself it is lawful for me to deliberate myself and all my deliberation is but concerning that,55,0,0.036357026,0,0.018178513,0.018178513,0,0,0.054535539,0,0.072714052
1183,Meditations,Marcus Aurelius,stoicism,which may be to me most profitable.,170,which may be to me most profitable,7,0,0,0,0,0,0,0,0,0,0
1184,Meditations,Marcus Aurelius,stoicism,"Now that unto every one is most profitable, which is according to his own constitution and nature.",170,now that unto every one is most profitable which is according to his own constitution and nature,17,0,0,0,0,0,0,0,0,0,0
1185,Meditations,Marcus Aurelius,stoicism,"And my nature is, to be rational in all my actions and as a good, and natural member of a city and commonwealth, towards my fellow members ever to be sociably and kindly disposed and affected.",170,and my nature is to be rational in all my actions and as good and natural member of city and commonwealth towards my fellow members ever to be sociably and kindly disposed and affected,34,0,0.058806233,0,0,0.029403117,0,0.029403117,0.147015584,0,0.147015584
1186,Meditations,Marcus Aurelius,stoicism,"My city and country as I am Antoninus, is Rome; as a man, the whole world.",170,my city and country as am antoninus is rome as man the whole world,14,0,0,0,0,0,0,0,0,0,0
1187,Meditations,Marcus Aurelius,stoicism,"Those things therefore that are expedient and profitable to those cities, are the only things that are good and expedient for me.",170,those things therefore that are expedient and profitable to those cities are the only things that are good and expedient for me,22,0,0.045433894,0,0,0.090867787,0,0.045433894,0.090867787,0,0.090867787
1188,Meditations,Marcus Aurelius,stoicism,"Whatsoever in any kind doth happen to any one, is expedient to the whole.",170,whatsoever in any kind doth happen to any one is expedient to the whole,14,0,0.071377587,0,0,0.142755175,0,0,0.142755175,0,0.142755175
1189,Meditations,Marcus Aurelius,stoicism,"And thus much to content us might suffice, that it is expedient for the whole in general.",170,and thus much to content us might suffice that it is expedient for the whole in general,17,0,0,0,0,0.117577895,0,0,0.176366843,0,0.176366843
1190,Meditations,Marcus Aurelius,stoicism,"But yet this also shalt thou generally perceive, if thou dost diligently take heed, that whatsoever doth happen to any one man or men.",170,but yet this also shalt thou generally perceive if thou dost diligently take heed that whatsoever doth happen to any one man or men,24,0,0.041649313,0,0,0,0,0,0.041649313,0,0.041649313
1191,Meditations,Marcus Aurelius,stoicism,"And now I am content that the word expedient, should more generally be understood of those things which we otherwise call middle things, or things indifferent; as health, wealth, and the like.",170,and now am content that the word expedient should more generally be understood of those things which we otherwise call middle things or things indifferent as health wealth and the like,31,0,0,0,0,0.096742986,0,0,0.128990648,0,0.128990648
1192,Meditations,Marcus Aurelius,stoicism,"As the ordinary shows of the theatre and of other such places, when thou art presented with them, affect thee; as the same things still seen, and in the same fashion, make the sight ingrateful and tedious; so must all the things that we see all our life long affect us.",170,as the ordinary shows of the theatre and of other such places when thou art presented with them affect thee as the same things still seen and in the same fashion make the sight ingrateful and tedious so must all the things that we see all our life long affect us,51,0,0.039207998,0,0,0.019603999,0.019603999,0.019603999,0,0.019603999,0.019603999
1193,Meditations,Marcus Aurelius,stoicism,"For all things, above and below, are still the same, and from the same causes.",170,for all things above and below are still the same and from the same causes,15,0,0,0,0,0,0,0,0,0,0
1194,Meditations,Marcus Aurelius,stoicism,When then will there be an end?.,170,when then will there be an end,7,0,0,0,0,0,0,0,0,0,0
1195,Meditations,Marcus Aurelius,stoicism,"Let the several deaths of men of all sorts, and of all sorts of professions, and of all sort of nations, be a perpetual object of thy thoughts,.",170,let the several deaths of men of all sorts and of all sorts of professions and of all sort of nations be perpetual object of thy thoughts,27,0,0,0,0,0,0,0,0,0,0
1196,Meditations,Marcus Aurelius,stoicism,"so that thou mayst even come down to Philistio, Phoebus, and Origanion.",170,so that thou mayst even come down to philistio phoebus and origanion,12,0,0,0,0,0,0,0,0,0,0
1197,Meditations,Marcus Aurelius,stoicism,Pass now to other generations.,170,pass now to other generations,5,0,0,0,0,0,0,0,0,0,0
1198,Meditations,Marcus Aurelius,stoicism,"Thither shall we after many changes, where so many brave orators are; where so many grave philosophers; Heraclitus, Pythagoras, Socrates.",170,thither shall we after many changes where so many brave orators are where so many grave philosophers heraclitus pythagoras socrates,20,0,0,0,0.049975012,0,0.049975012,0,0,0.049975012,0
1199,Meditations,Marcus Aurelius,stoicism,Where so many heroes of the old times; and then so many brave captains of the latter times; and so many kings.,170,where so many heroes of the old times and then so many brave captains of the latter times and so many kings,22,0,0,0,0,0,0,0,0,0,0
1200,Meditations,Marcus Aurelius,stoicism,"After all these, where Eudoxus, Hipparchus, Archimedes; where so many other sharp, generous, industrious, subtile, peremptory dispositions; and among others, even they, that have been the greatest scoffers and deriders of the frailty and brevity of this our human life; as Menippus, and others, as many as there have been such as he.",170,after all these where eudoxus hipparchus archimedes where so many other sharp generous industrious subtile peremptory dispositions and among others even they that have been the greatest scoffers and deriders of the frailty and brevity of this our human life as menippus and others as many as there have been such as he,53,0,0,0,0,0.018864365,0.018864365,0,0.018864365,0.018864365,0.018864365
1201,Meditations,Marcus Aurelius,stoicism,"Of all these consider, that they long since are all dead, and gone.",170,of all these consider that they long since are all dead and gone,13,0,0.076863951,0,0,0,0,0,0,0,0
1202,Meditations,Marcus Aurelius,stoicism,And what do they suffer by it!,170,and what do they suffer by it,7,0,0,0,0,0,0,0,0,0.142653352,0
1203,Meditations,Marcus Aurelius,stoicism,they that have not so much as a name remaining,170,they that have not so much as name remaining,9,0,0,0,0,0,0,0,0,0,0
1204,Meditations,Marcus Aurelius,stoicism,", what are they the worse for it?",170,what are they the worse for it,7,0,0,0,0.142653352,0,0.142653352,0,0,0.142653352,0
1205,Meditations,Marcus Aurelius,stoicism,"One thing there is, and that only, which is worth our while in this world, and ought by us much to be esteemed; and that is, according to truth and righteousness, meekly and lovingly to converse with false, and unrighteous men.",170,one thing there is and that only which is worth our while in this world and ought by us much to be esteemed and that is according to truth and righteousness meekly and lovingly to converse with false and unrighteous men,41,0,0,0,0,0,0,0,0.024384297,0,0.048768593
1206,Meditations,Marcus Aurelius,stoicism,"When thou wilt comfort and cheer thyself, call to mind the several gifts and virtues of them, whom thou dost daily converse with; as for example, the industry of the one; the modesty of another; the liberality of a third; of another some other thing.",170,when thou wilt comfort and cheer thyself call to mind the several gifts and virtues of them whom thou dost daily converse with as for example the industry of the one the modesty of another the liberality of third of another some other thing,44,0,0.068166326,0,0,0.045444217,0,0.022722109,0.045444217,0,0.068166326
1207,Meditations,Marcus Aurelius,stoicism,"For nothing can so much rejoice thee, as the resemblances and parallels of several virtues, visible and eminent in the dispositions of those who live with thee; especially when, all at once, as near as may be, they represent themselves unto thee.",170,for nothing can so much rejoice thee as the resemblances and parallels of several virtues visible and eminent in the dispositions of those who live with thee especially when all at once as near as may be they represent themselves unto thee,42,0,0.023803856,0,0,0.023803856,0,0.023803856,0.023803856,0,0.047607712
1208,Meditations,Marcus Aurelius,stoicism,And therefore thou must have them always in a readiness.,170,and therefore thou must have them always in readiness,9,0,0.110987791,0,0,0.110987791,0,0,0.110987791,0,0.110987791
1209,Meditations,Marcus Aurelius,stoicism,Dost thou grieve that thou dost weigh,170,dost thou grieve that thou dost weigh,7,0,0.142653352,0,0.142653352,0,0.142653352,0,0.142653352,0.142653352,0
1210,Meditations,Marcus Aurelius,stoicism,"but so many pounds, and not three hundred rather?",170,but so many pounds and not three hundred rather,9,0,0,0,0,0,0,0,0,0,0
1211,Meditations,Marcus Aurelius,stoicism,"Just as much reason hast thou to grieve that thou must live but so many years, and not longer.",170,just as much reason hast thou to grieve that thou must live but so many years and not longer,19,0,0,0,0.052603893,0,0.052603893,0,0,0.052603893,0.052603893
1212,Meditations,Marcus Aurelius,stoicism,For as for bulk and substance thou dost content thyself with that proportion of it that is allotted unto thee,170,for as for bulk and substance thou dost content thyself with that proportion of it that is allotted unto thee,20,0,0,0,0,0.049975012,0,0,0.049975012,0,0.099950025
1213,Meditations,Marcus Aurelius,stoicism,", so shouldst thou for time.",170,so shouldst thou for time,5,0,0.199600798,0,0,0,0,0,0,0,0
1214,Meditations,Marcus Aurelius,stoicism,"Let us do our best endeavours to persuade them; but however, if reason and justice lead thee to it, do it, though they be never so much against it.",170,let us do our best endeavours to persuade them but however if reason and justice lead thee to it do it though they be never so much against it,29,0,0,0,0,0,0,0,0.068941744,0,0.103412616
1215,Meditations,Marcus Aurelius,stoicism,"But if any shall by force withstand thee, and hinder thee in it, convert thy virtuous inclination from one object unto another, from justice to contented equanimity, and cheerful patience: so that what in the one is thy hindrance, thou",170,but if any shall by force withstand thee and hinder thee in it convert thy virtuous inclination from one object unto another from justice to contented equanimity and cheerful patience so that what in the one is thy hindrance thou,40,0.024993752,0.049987503,0,0.049987503,0.049987503,0,0.024993752,0.074981255,0.049987503,0.149962509
1216,Meditations,Marcus Aurelius,stoicism,"mayst make use of it for the exercise of another virtue: and remember that it was with due exception, and reservation, that thou didst at first incline and desire.",170,mayst make use of it for the exercise of another virtue and remember that it was with due exception and reservation that thou didst at first incline and desire,29,0,0,0,0,0,0,0,0.068941744,0,0.034470872
1217,Meditations,Marcus Aurelius,stoicism,For thou didst not set thy mind upon things impossible.,170,for thou didst not set thy mind upon things impossible,10,0,0,0,0,0,0.0999001,0,0,0.0999001,0
1218,Meditations,Marcus Aurelius,stoicism,Upon what then? that all thy desires might ever be moderated with this due kind of reservation.,170,upon what then that all thy desires might ever be moderated with this due kind of reservation,17,0,0,0,0,0.058788948,0,0,0.058788948,0,0.058788948
1219,Meditations,Marcus Aurelius,stoicism,"And this thou hast, and mayst always obtain, whether the thing desired be in thy power or no.",170,and this thou hast and mayst always obtain whether the thing desired be in thy power or no,18,0,0,0,0,0,0,0,0,0,0
1220,Meditations,Marcus Aurelius,stoicism,"And what do I care for more, if that for which I was born and brought forth into the world (to rule all my desires with reason and discretion) may be?.",170,and what do care for more if that for which was born and brought forth into the world to rule all my desires with reason and discretion may be,29,0,0.034470872,0,0.034470872,0,0,0,0.068941744,0,0.068941744
1221,Meditations,Marcus Aurelius,stoicism,"The ambitious supposeth another man's act, praise and applause, to be his own happiness; the voluptuous his own sense and feeling; but he that is wise, his own action.",170,the ambitious supposeth another man act praise and applause to be his own happiness the voluptuous his own sense and feeling but he that is wise his own action,29,0.034470872,0.103412616,0.034470872,0.034470872,0.172354361,0.034470872,0.068941744,0.103412616,0.034470872,0.275766977
1222,Meditations,Marcus Aurelius,stoicism,"It is in thy power absolutely to exclude all manner of conceit and opinion, as concerning this matter; and by the same means, to exclude all grief and sorrow from thy soul.",170,it is in thy power absolutely to exclude all manner of conceit and opinion as concerning this matter and by the same means to exclude all grief and sorrow from thy soul,32,0,0,0,0.031240237,0,0.062480475,0,0,0.093720712,0
1223,Meditations,Marcus Aurelius,stoicism,"For as for the things and objects themselves, they of themselves have no such power, whereby to beget and force upon us any opinion at all.",170,for as for the things and objects themselves they of themselves have no such power whereby to beget and force upon us any opinion at all,26,0.038446751,0,0,0.038446751,0,0,0,0,0.038446751,0
1224,Meditations,Marcus Aurelius,stoicism,"Use thyself when any man speaks unto thee, so to hearken unto him, as that in the interim thou give not way to any other thoughts; that so thou mayst (as far as is possible) seem fixed and fastened to his very soul, whosoever he be that speaks unto thee.",170,use thyself when any man speaks unto thee so to hearken unto him as that in the interim thou give not way to any other thoughts that so thou mayst as far as is possible seem fixed and fastened to his very soul whosoever he be that speaks unto thee,50,0,0.019996001,0,0,0,0,0,0.019996001,0,0
1225,Meditations,Marcus Aurelius,stoicism,"That which is not good for the bee hive, cannot be good for the bee.",170,that which is not good for the bee hive cannot be good for the bee,15,0.066622252,0.066622252,0,0.066622252,0.066622252,0,0.066622252,0.066622252,0.066622252,0.066622252
1226,Meditations,Marcus Aurelius,stoicism,"Will either passengers, or patients, find fault and complain, either the one if they be well carried, or the others if well cured?",170,will either passengers or patients find fault and complain either the one if they be well carried or the others if well cured,23,0.043459365,0,0,0,0,0.086918731,0,0,0.086918731,0
1227,Meditations,Marcus Aurelius,stoicism,"Do they take care for any more than this; the one, that their shipmaster may bring them safe to land, and the other, that their physician may effect their recovery?.",170,do they take care for any more than this the one that their shipmaster may bring them safe to land and the other that their physician may effect their recovery,30,0,0,0,0,0.033322226,0,0,0.066644452,0,0.133288904
1228,Meditations,Marcus Aurelius,stoicism,"How many of them who came into the world at the same time when I did, are already gone out of it?.",170,how many of them who came into the world at the same time when did are already gone out of it,21,0,0.047596383,0,0,0,0,0,0,0,0
1229,Meditations,Marcus Aurelius,stoicism,"To them that are sick of the jaundice, honey seems bitter; and to them that are bitten by a mad dog, the water terrible; and to children, a little ball seems a fine thing.",170,to them that are sick of the jaundice honey seems bitter and to them that are bitten by mad dog the water terrible and to children little ball seems fine thing,31,0.064495324,0,0.096742986,0.096742986,0,0.096742986,0,0,0.128990648,0.032247662
1230,Meditations,Marcus Aurelius,stoicism,And why then should I be angry?,170,and why then should be angry,6,0.166389351,0,0.166389351,0,0,0,0,0,0.166389351,0
1231,Meditations,Marcus Aurelius,stoicism,"or do I think that error and false opinion is less powerful to make men transgress, than either choler, being immoderate and excessive, to cause the jaundice; or poison, to cause rage?.",170,or do think that error and false opinion is less powerful to make men transgress than either choler being immoderate and excessive to cause the jaundice or poison to cause rage,31,0.096742986,0.032247662,0.064495324,0.096742986,0.032247662,0.064495324,0,0.032247662,0.128990648,0.032247662
1232,Meditations,Marcus Aurelius,stoicism,No man can hinder thee to live as thy nature doth require.,170,no man can hinder thee to live as thy nature doth require,12,0,0,0,0,0,0,0,0,0,0
1233,Meditations,Marcus Aurelius,stoicism,"Nothing can happen unto thee, but what the common good of nature doth require.",170,nothing can happen unto thee but what the common good of nature doth require,14,0,0.142755175,0,0,0.071377587,0,0.071377587,0.071377587,0,0.071377587
1234,Meditations,Marcus Aurelius,stoicism,"What manner of men they be whom they seek to please, and what to get, and by what actions: how soon time will cover and bury all things, and how many it hath already buried!.",170,what manner of men they be whom they seek to please and what to get and by what actions how soon time will cover and bury all things and how many it hath already buried,35,0,0.057126535,0,0.028563268,0,0.057126535,0,0.028563268,0.028563268,0
1235,Meditations,Marcus Aurelius,stoicism,It is that which many time and often thou hast already seen and known in the world.,170,it is that which many time and often thou hast already seen and known in the world,17,0,0.058788948,0,0,0,0,0,0,0,0
1236,Meditations,Marcus Aurelius,stoicism,"And so oft as anything doth happen that might otherwise trouble thee, let this memento presently come to thy mind, that it is that which thou hast already often Seen and known.",170,and so oft as anything doth happen that might otherwise trouble thee let this memento presently come to thy mind that it is that which thou hast already often seen and known,32,0,0.031240237,0,0,0,0,0,0,0,0.031240237
1237,Meditations,Marcus Aurelius,stoicism,"Generally, above and below, thou shalt find but the same things.",170,generally above and below thou shalt find but the same things,11,0,0,0,0,0,0,0,0,0,0
1238,Meditations,Marcus Aurelius,stoicism,"The very same things whereof ancient stories, middle age stories, and fresh stories are full whereof",170,the very same things whereof ancient stories middle age stories and fresh stories are full whereof,16,0,0,0,0,0,0,0,0,0.062460962,0.062460962
1239,Meditations,Marcus Aurelius,stoicism,"towns are full, and houses full.",170,towns are full and houses full,6,0,0,0,0,0,0,0,0,0,0.166389351
1240,Meditations,Marcus Aurelius,stoicism,There is nothing that is new.,170,there is nothing that is new,6,0,0,0,0,0,0,0,0,0,0
1241,Meditations,Marcus Aurelius,stoicism,"All things that are, are both usual and of little continuance.",170,all things that are are both usual and of little continuance,11,0,0,0,0,0,0,0,0.090826521,0,0.090826521
1242,Meditations,Marcus Aurelius,stoicism,"What fear is there that thy dogmata, or philosophical resolutions and conclusions, should become dead in thee, and lose their proper power and efficacy to make thee live happy, as long as those proper and correlative fancies, and representations of things on which they mutually depend (which continually to stir up and revive is in thy power,)",170,what fear is there that thy dogmata or philosophical resolutions and conclusions should become dead in thee and lose their proper power and efficacy to make thee live happy as long as those proper and correlative fancies and representations of things on which they mutually depend which continually to stir up and revive is in thy power,57,0.035081565,0.070163129,0.017540782,0.035081565,0.017540782,0.017540782,0.017540782,0.035081565,0.052622347,0.070163129
1243,Meditations,Marcus Aurelius,stoicism,are still kept fresh and alive?,170,are still kept fresh and alive,6,0,0.166389351,0,0,0.166389351,0,0,0.166389351,0,0.166389351
