index,title,author,school,sentence_str,original_publication_date,sentences,word.count,anger,anticipation,disgust,fear,joy,sadness,surprise,trust,negative,positive
1905,Meditations,Marcus Aurelius,stoicism,"The sum then of all; whatsoever doth happen unto thee, whereof God is the cause, to accept it contentedly:",170,the sum then of all whatsoever doth happen unto thee whereof god is the cause to accept it contentedly,19,0,0.105207785,0,0.052603893,0.052603893,0,0,0.052603893,0,0.052603893
1906,Meditations,Marcus Aurelius,stoicism,"whatsoever thou doest, whereof thou thyself art the cause, to do it justly:",170,whatsoever thou doest whereof thou thyself art the cause to do it justly,13,0,0.076863951,0,0,0.076863951,0.076863951,0.076863951,0,0,0.076863951
1907,Meditations,Marcus Aurelius,stoicism,"which will be, if both in thy resolution and in thy action thou have no further end, than to do good unto others, as being that, which by thy natural constitution, as a man, thou art bound unto.",170,which will be if both in thy resolution and in thy action thou have no further end than to do good unto others as being that which by thy natural constitution as man thou art bound unto,37,0,0.054039449,0,0,0.054039449,0.027019724,0.054039449,0.027019724,0.027019724,0.081059173
1908,Meditations,Marcus Aurelius,stoicism,"Many of those things that trouble and straiten thee, it is in thy power to cut off, as wholly depending from mere conceit and opinion; and then thou shalt have room enough.",170,many of those things that trouble and straiten thee it is in thy power to cut off as wholly depending from mere conceit and opinion and then thou shalt have room enough,32,0,0,0,0,0,0,0,0,0.031240237,0
1909,Meditations,Marcus Aurelius,stoicism,"To comprehend the whole world together in thy mind, and the whole course of this present age to represent it unto thyself, and to fix thy thoughts upon the sudden change of every particular object.",170,to comprehend the whole world together in thy mind and the whole course of this present age to represent it unto thyself and to fix thy thoughts upon the sudden change of every particular object,35,0,0.028563268,0,0.028563268,0.028563268,0,0.057126535,0.028563268,0,0.057126535
1910,Meditations,Marcus Aurelius,stoicism,"How short the time is from the generation of anything, unto the dissolution of the same; but how immense and infinite both that which was before the generation, and",170,how short the time is from the generation of anything unto the dissolution of the same but how immense and infinite both that which was before the generation and,29,0.034470872,0.034470872,0,0.034470872,0,0.034470872,0.034470872,0,0.034470872,0.068941744
1911,Meditations,Marcus Aurelius,stoicism,that which after the generation of it shall be.,170,that which after the generation of it shall be,9,0,0,0,0,0,0,0,0,0,0
1912,Meditations,Marcus Aurelius,stoicism,"All things that thou seest, will soon be perished, and they that see their corruptions, will soon vanish away themselves.",170,all things that thou seest will soon be perished and they that see their corruptions will soon vanish away themselves,20,0,0,0,0,0,0.049975012,0.049975012,0,0.049975012,0
1913,Meditations,Marcus Aurelius,stoicism,"He that dieth a hundred years old, and he that dieth young, shall come all to one.",170,he that dieth hundred years old and he that dieth young shall come all to one,16,0,0.062460962,0,0,0.062460962,0,0.062460962,0,0,0.062460962
1914,Meditations,Marcus Aurelius,stoicism,"What are their minds and understandings; and what the things that they apply themselves unto: what do they love, and what do they hate for?",170,what are their minds and understandings and what the things that they apply themselves unto what do they love and what do they hate for,25,0.039984006,0,0.039984006,0.039984006,0.039984006,0.039984006,0,0,0.039984006,0.039984006
1915,Meditations,Marcus Aurelius,stoicism,Fancy to thyself the estate of their souls openly to be seen.,170,fancy to thyself the estate of their souls openly to be seen,12,0,0.083263947,0,0,0.083263947,0,0,0,0,0.083263947
1916,Meditations,Marcus Aurelius,stoicism,"When they think they hurt them shrewdly, whom they speak ill of; and when they think they do them a very good turn, whom they commend and extol: how full are they then of conceit, and opinion!.",170,when they think they hurt them shrewdly whom they speak ill of and when they think they do them very good turn whom they commend and extol how full are they then of conceit and opinion,36,0.055540128,0.027770064,0.027770064,0.055540128,0.027770064,0.055540128,0.027770064,0.027770064,0.083310192,0.083310192
1917,Meditations,Marcus Aurelius,stoicism,"Loss and corruption, is in very deed nothing else but change and alteration; and that is it, which the nature of the universe doth most delight in, by which, and according to which, whatsoever is done, is well done.",170,loss and corruption is in very deed nothing else but change and alteration and that is it which the nature of the universe doth most delight in by which and according to which whatsoever is done is well done,39,0.025634453,0.025634453,0.025634453,0.051268905,0.025634453,0.025634453,0,0.025634453,0.051268905,0.025634453
1918,Meditations,Marcus Aurelius,stoicism,"For that was the estate of worldly things from the beginning, and so shall it ever be.",170,for that was the estate of worldly things from the beginning and so shall it ever be,17,0,0,0,0,0,0,0,0,0,0
1919,Meditations,Marcus Aurelius,stoicism,"Or wouldest thou rather say, that all things in the world have gone ill from the beginning for so many ages, and shall ever go ill?",170,or wouldest thou rather say that all things in the world have gone ill from the beginning for so many ages and shall ever go ill,26,0.038446751,0,0.038446751,0.038446751,0,0.038446751,0,0,0.038446751,0
1920,Meditations,Marcus Aurelius,stoicism,"And then among so many deities, could no divine power be found all this while, that could rectify the things of the world?",170,and then among so many deities could no divine power be found all this while that could rectify the things of the world,23,0,0,0,0,0.043459365,0,0,0.043459365,0,0.086918731
1921,Meditations,Marcus Aurelius,stoicism,"Or is the world, to incessant woes and miseries, for ever condemned?.",170,or is the world to incessant woes and miseries for ever condemned,12,0,0,0,0,0,0,0,0,0.083263947,0
1922,Meditations,Marcus Aurelius,stoicism,"How base and putrid, every common matter is!",170,how base and putrid every common matter is,8,0,0,0,0,0,0,0,0.124843945,0,0
1923,Meditations,Marcus Aurelius,stoicism,"Water, dust, and from the mixture of these bones, and all that loathsome stuff that our bodies do consist of: so subject to be infected, and corrupted.",170,water dust and from the mixture of these bones and all that loathsome stuff that our bodies do consist of so subject to be infected and corrupted,27,0.037023325,0,0.037023325,0,0,0,0,0,0.111069974,0
1924,Meditations,Marcus Aurelius,stoicism,"And again those other things that are so much prized and admired, as marble stones, what are they, but as it were the kernels of the earth?",170,and again those other things that are so much prized and admired as marble stones what are they but as it were the kernels of the earth,27,0,0,0,0,0,0,0,0,0,0
1925,Meditations,Marcus Aurelius,stoicism,"gold and silver, what are they, but as the more gross faeces of the earth?",170,gold and silver what are they but as the more gross faeces of the earth,15,0,0,0.133244504,0,0,0,0,0,0.133244504,0.066622252
1926,Meditations,Marcus Aurelius,stoicism,"Thy most royal apparel, for matter, it is but as it were the hair of a silly sheep, and for colour, the very blood of a shell fish; of this nature are all other things.",170,thy most royal apparel for matter it is but as it were the hair of silly sheep and for colour the very blood of shell fish of this nature are all other things,33,0.03029385,0,0,0.03029385,0.03029385,0.03029385,0.03029385,0,0.060587701,0
1927,Meditations,Marcus Aurelius,stoicism,"Thy life itself, is some such thing too; a mere exhalation of blood: and it also, apt to be changed into some other common thing.",170,thy life itself is some such thing too mere exhalation of blood and it also apt to be changed into some other common thing,24,0,0,0,0,0,0,0,0,0,0.041649313
1928,Meditations,Marcus Aurelius,stoicism,"Will this querulousness, this murmuring, this complaining and dissembling never be at an end?",170,will this querulousness this murmuring this complaining and dissembling never be at an end,14,0,0,0,0,0,0,0,0,0,0
1929,Meditations,Marcus Aurelius,stoicism,"What then is it, that troubleth thee?",170,what then is it that troubleth thee,7,0,0,0,0,0,0,0,0,0,0
1930,Meditations,Marcus Aurelius,stoicism,Doth any new thing happen unto thee?,170,doth any new thing happen unto thee,7,0,0.142653352,0,0,0,0,0,0,0,0
1931,Meditations,Marcus Aurelius,stoicism,What doest thou so wonder at?,170,what doest thou so wonder at,6,0,0,0,0,0,0,0,0,0,0
1932,Meditations,Marcus Aurelius,stoicism,"At the cause, or the matter?",170,at the cause or the matter,6,0,0,0,0,0,0,0,0,0,0
1933,Meditations,Marcus Aurelius,stoicism,"Behold either by itself, is either of that weight and moment indeed?",170,behold either by itself is either of that weight and moment indeed,12,0,0.083263947,0.083263947,0.083263947,0.083263947,0.083263947,0.083263947,0.083263947,0.083263947,0.083263947
1934,Meditations,Marcus Aurelius,stoicism,"And besides these, there is not anything.",170,and besides these there is not anything,7,0,0,0,0,0,0,0,0,0,0
1935,Meditations,Marcus Aurelius,stoicism,But thy duty towards the Gods,170,but thy duty towards the gods,6,0,0,0,0,0,0,0,0,0,0
1936,Meditations,Marcus Aurelius,stoicism,"also, it is time thou",170,also it is time thou,5,0,0.199600798,0,0,0,0,0,0,0,0
1937,Meditations,Marcus Aurelius,stoicism,shouldst acquit thyself of it with more goodness and simplicity.,170,shouldst acquit thyself of it with more goodness and simplicity,10,0,0.0999001,0,0,0.0999001,0,0.0999001,0.0999001,0,0.0999001
1938,Meditations,Marcus Aurelius,stoicism,It is all one to see these things for a hundred of years together or but for three years.,170,it is all one to see these things for hundred of years together or but for three years,18,0,0,0,0,0,0,0,0,0,0
1939,Meditations,Marcus Aurelius,stoicism,"If he have sinned, his is the harm, not mine.",170,if he have sinned his is the harm not mine,10,0,0,0,0.0999001,0,0,0,0,0.0999001,0
1940,Meditations,Marcus Aurelius,stoicism,But perchance he hath not.,170,but perchance he hath not,5,0,0,0,0,0,0,0.199600798,0,0,0
1941,Meditations,Marcus Aurelius,stoicism,"Either all things by the providence of reason happen unto every particular, as a part of one general body; and then it is against reason that a part should complain of anything that happens for the good of the whole; or if, according to Epicurus, atoms be the cause of all things and that life be nothing else but an accidentary confusion of things, and death nothing else, but a mere dispersion and so of all other things: what doest thou trouble thyself for?.",170,either all things by the providence of reason happen unto every particular as part of one general body and then it is against reason that part should complain of anything that happens for the good of the whole or if according to epicurus atoms be the cause of all things and that life be nothing else but an accidentary confusion of things and death nothing else but mere dispersion and so of all other things what doest thou trouble thyself for,81,0.037032465,0.037032465,0.012344155,0.02468831,0.012344155,0.02468831,0.02468831,0.02468831,0.04937662,0.037032465
1942,Meditations,Marcus Aurelius,stoicism,"Sayest thou unto that rational part, Thou art dead; corruption hath taken hold on thee?",170,sayest thou unto that rational part thou art dead corruption hath taken hold on thee,15,0,0.066622252,0.066622252,0,0.066622252,0.066622252,0.066622252,0.066622252,0.066622252,0.133244504
1943,Meditations,Marcus Aurelius,stoicism,Doth it then also void excrements?,170,doth it then also void excrements,6,0,0,0,0,0,0,0,0,0,0
1944,Meditations,Marcus Aurelius,stoicism,"Doth it like either oxen, or sheep, graze or feed; that it also should be mortal, as well as the body?.",170,doth it like either oxen or sheep graze or feed that it also should be mortal as well as the body,21,0,0,0,0,0,0,0,0,0.047596383,0
1945,Meditations,Marcus Aurelius,stoicism,"Either the Gods can do nothing for us at all, or they can still and allay all the distractions and distempers of thy mind.",170,either the gods can do nothing for us at all or they can still and allay all the distractions and distempers of thy mind,24,0,0,0,0,0,0,0,0,0,0.041649313
1946,Meditations,Marcus Aurelius,stoicism,"If they can do nothing, why doest thou pray?",170,if they can do nothing why doest thou pray,9,0,0.110987791,0,0.110987791,0.110987791,0,0.110987791,0.110987791,0,0.110987791
1947,Meditations,Marcus Aurelius,stoicism,"If they can, why wouldst not thou rather pray, that they will grant unto thee, that thou mayst neither fear, nor lust after any of those worldly things which cause these distractions and distempers of it?",170,if they can why wouldst not thou rather pray that they will grant unto thee that thou mayst neither fear nor lust after any of those worldly things which cause these distractions and distempers of it,36,0.027770064,0.083310192,0,0.055540128,0.055540128,0,0.027770064,0.055540128,0.055540128,0.055540128
1948,Meditations,Marcus Aurelius,stoicism,"Why not rather, that thou mayst not at either their absence or presence, be grieved and discontented: than either that thou mayst obtain them, or that thou mayst avoid them?",170,why not rather that thou mayst not at either their absence or presence be grieved and discontented than either that thou mayst obtain them or that thou mayst avoid them,30,0,0,0,0.066644452,0,0.033322226,0,0,0.066644452,0.033322226
1949,Meditations,Marcus Aurelius,stoicism,"For certainly it must needs be, that if the Gods can help us in anything, they may in this kind also.",170,for certainly it must needs be that if the gods can help us in anything they may in this kind also,21,0,0,0,0,0.047596383,0,0,0.047596383,0,0.047596383
1950,Meditations,Marcus Aurelius,stoicism,"But thou wilt say perchance, 'In those things the Gods have given me my liberty: and it is in mine own power to do what I will.'",170,but thou wilt say perchance in those things the gods have given me my liberty and it is in mine own power to do what will,26,0,0.038446751,0,0,0.038446751,0,0.076893502,0.038446751,0,0.038446751
1951,Meditations,Marcus Aurelius,stoicism,"But if thou mayst use this liberty, rather to set thy mind at true liberty, than wilfully with baseness and servility of mind to affect those things, which either to compass or to avoid is not in thy power, wert not thou better?",170,but if thou mayst use this liberty rather to set thy mind at true liberty than wilfully with baseness and servility of mind to affect those things which either to compass or to avoid is not in thy power wert not thou better,43,0,0.023250407,0,0.023250407,0.023250407,0,0.023250407,0.046500814,0.023250407,0.023250407
1952,Meditations,Marcus Aurelius,stoicism,"And as for the Gods, who hath told thee, that they may not help us up even in those things that they have put in our own power?",170,and as for the gods who hath told thee that they may not help us up even in those things that they have put in our own power,28,0,0,0,0,0,0,0,0,0,0
1953,Meditations,Marcus Aurelius,stoicism,"whether it be so or no, thou shalt soon perceive, if thou wilt but try thyself and pray.",170,whether it be so or no thou shalt soon perceive if thou wilt but try thyself and pray,18,0,0.055524708,0,0.055524708,0.055524708,0,0.055524708,0.111049417,0,0.111049417
1954,Meditations,Marcus Aurelius,stoicism,"One prayeth that he may compass his desire, to lie with such or such a one, pray thou that thou mayst not lust to lie with her.",170,one prayeth that he may compass his desire to lie with such or such one pray thou that thou mayst not lust to lie with her,26,0.038446751,0.076893502,0.038446751,0.038446751,0.038446751,0.038446751,0.038446751,0.076893502,0.076893502,0.038446751
1955,Meditations,Marcus Aurelius,stoicism,Another how he may be rid of such a one; pray thou that thou,170,another how he may be rid of such one pray thou that thou,13,0,0.076863951,0,0.076863951,0.076863951,0,0.076863951,0.076863951,0,0.076863951
1956,Meditations,Marcus Aurelius,stoicism,"mayst so patiently bear with him, as that thou have no such need to be rid of him.",170,mayst so patiently bear with him as that thou have no such need to be rid of him,18,0.055524708,0,0,0.055524708,0,0,0,0,0,0
1957,Meditations,Marcus Aurelius,stoicism,"Another, that he may not lose his child.",170,another that he may not lose his child,8,0.124843945,0.124843945,0.124843945,0.124843945,0.124843945,0.124843945,0.124843945,0,0.124843945,0.124843945
1958,Meditations,Marcus Aurelius,stoicism,Pray thou that thou mayst not fear to lose him.,170,pray thou that thou mayst not fear to lose him,10,0.1998002,0.0999001,0.0999001,0.2997003,0.0999001,0.0999001,0.1998002,0.0999001,0.1998002,0.0999001
1959,Meditations,Marcus Aurelius,stoicism,"To this end and purpose, let all thy prayer be, and see what will be the event. '",170,to this end and purpose let all thy prayer be and see what will be the event,17,0,0,0,0,0,0,0,0,0,0
1960,Meditations,Marcus Aurelius,stoicism,"In my sickness' (saith Epicurus of himself:) 'my discourses were not concerning the nature of my disease, neither was that, to them that came to visit me, the subject of my talk; but in the consideration and contemplation of that, which was of especial weight and moment, was all my time bestowed and spent, and among others in this very thing, how my mind, by a natural and unavoidable sympathy partaking in some sort with the present indisposition of my body, might nevertheless keep herself free from trouble, and in present possession of her own proper happiness.",170,in my sickness saith epicurus of himself my discourses were not concerning the nature of my disease neither was that to them that came to visit me the subject of my talk but in the consideration and contemplation of that which was of especial weight and moment was all my time bestowed and spent and among others in this very thing how my mind by natural and unavoidable sympathy partaking in some sort with the present indisposition of my body might nevertheless keep herself free from trouble and in present possession of her own proper happiness,96,0.020831163,0.041662327,0.041662327,0.041662327,0.031246745,0.041662327,0.020831163,0.020831163,0.072909072,0.083324654
1961,Meditations,Marcus Aurelius,stoicism,Neither did I leave the ordering of my body to the physicians altogether to do with me,170,neither did leave the ordering of my body to the physicians altogether to do with me,16,0,0,0,0,0,0.062460962,0.062460962,0,0.062460962,0
1962,Meditations,Marcus Aurelius,stoicism,"what they would, as though I expected any great matter from them, or as though I thought it a matter of such great consequence, by their means to recover my health: for my present estate, methought, liked me very well, and gave me good content.",170,what they would as though expected any great matter from them or as though thought it matter of such great consequence by their means to recover my health for my present estate methought liked me very well and gave me good content,42,0,0.095215425,0,0,0.071411569,0,0.047607712,0.071411569,0,0.071411569
1963,Meditations,Marcus Aurelius,stoicism,"Whether therefore in sickness (if thou chance to sicken) or in what other kind of extremity soever, endeavour thou also to be in thy mind so affected, as he doth report of himself: not to depart from thy philosophy for anything that can befall thee, nor to give ear to the discourses of silly people, and mere naturalists.",170,whether therefore in sickness if thou chance to sicken or in what other kind of extremity soever endeavour thou also to be in thy mind so affected as he doth report of himself not to depart from thy philosophy for anything that can befall thee nor to give ear to the discourses of silly people and mere naturalists,58,0,0.017238407,0.017238407,0.017238407,0.034476814,0.034476814,0.017238407,0.017238407,0.068953629,0.017238407
1964,Meditations,Marcus Aurelius,stoicism,"It is common to all trades and professions to mind and intend that only, which now they are about, and the instrument whereby they work.",170,it is common to all trades and professions to mind and intend that only which now they are about and the instrument whereby they work,25,0,0,0,0,0,0,0,0.039984006,0,0
1965,Meditations,Marcus Aurelius,stoicism,"When at any time thou art offended with any one's impudency, put presently this question to thyself: 'What?",170,when at any time thou art offended with any one impudency put presently this question to thyself what,18,0.055524708,0.111049417,0,0,0.055524708,0.111049417,0.055524708,0,0.055524708,0.111049417
1966,Meditations,Marcus Aurelius,stoicism,"Is it then possible, that there should not be any impudent men in the world!",170,is it then possible that there should not be any impudent men in the world,15,0,0,0,0,0,0,0,0,0,0
1967,Meditations,Marcus Aurelius,stoicism,Certainly it is not possible.',170,certainly it is not possible,5,0,0,0,0,0,0,0,0,0,0
1968,Meditations,Marcus Aurelius,stoicism,Desire not then that which is impossible.,170,desire not then that which is impossible,7,0,0,0,0,0,0.142653352,0,0,0.142653352,0
1969,Meditations,Marcus Aurelius,stoicism,"For this one, (thou must think) whosoever he be, is one of those impudent ones, that the world cannot be without.",170,for this one thou must think whosoever he be is one of those impudent ones that the world cannot be without,21,0,0,0,0,0,0,0,0,0,0
1970,Meditations,Marcus Aurelius,stoicism,"So of the subtile and crafty, so of the perfidious, so of every one that offendeth, must thou ever be ready to reason with thyself.",170,so of the subtile and crafty so of the perfidious so of every one that offendeth must thou ever be ready to reason with thyself,25,0,0.039984006,0,0,0,0,0,0,0,0.039984006
1971,Meditations,Marcus Aurelius,stoicism,"For whilst in general thou dost thus reason with thyself, that the kind of them must needs be in the world, thou wilt",170,for whilst in general thou dost thus reason with thyself that the kind of them must needs be in the world thou wilt,23,0,0,0,0,0.043459365,0,0,0.086918731,0,0.130378096
1972,Meditations,Marcus Aurelius,stoicism,be the better able to use meekness towards every particular.,170,be the better able to use meekness towards every particular,10,0,0,0,0,0,0,0,0,0,0
1973,Meditations,Marcus Aurelius,stoicism,"This also thou shalt find of very good use, upon every such occasion, presently to consider with thyself, what proper virtue nature hath furnished man with, against such a vice, or to encounter with a disposition vicious in this kind.",170,this also thou shalt find of very good use upon every such occasion presently to consider with thyself what proper virtue nature hath furnished man with against such vice or to encounter with disposition vicious in this kind,38,0.026308866,0.026308866,0.026308866,0,0.052617732,0,0.026308866,0.078926598,0.052617732,0.105235464
1974,Meditations,Marcus Aurelius,stoicism,"As for example, against the unthankful, it hath given goodness and meekness, as an antidote, and so against another vicious in another kind some other peculiar faculty.",170,as for example against the unthankful it hath given goodness and meekness as an antidote and so against another vicious in another kind some other peculiar faculty,27,0.037023325,0.074046649,0.037023325,0,0.074046649,0,0.037023325,0.148093299,0.037023325,0.148093299
1975,Meditations,Marcus Aurelius,stoicism,"And generally, is it not in thy power to instruct him better, that is in an error?",170,and generally is it not in thy power to instruct him better that is in an error,17,0,0,0,0,0,0.058788948,0,0.058788948,0.058788948,0.058788948
1976,Meditations,Marcus Aurelius,stoicism,"For whosoever sinneth, doth in that decline from his purposed end, and is certainly deceived, And again, what art thou the worse for his sin?",170,for whosoever sinneth doth in that decline from his purposed end and is certainly deceived and again what art thou the worse for his sin,25,0.079968013,0.039984006,0.039984006,0.079968013,0.039984006,0.119952019,0.039984006,0,0.159936026,0.039984006
1977,Meditations,Marcus Aurelius,stoicism,"For thou shalt not find that any one of these, against whom thou art incensed, hath in very deed done anything whereby thy mind (the only true subject of thy hurt and evil) can be made worse than it was.",170,for thou shalt not find that any one of these against whom thou art incensed hath in very deed done anything whereby thy mind the only true subject of thy hurt and evil can be made worse than it was,40,0.049987503,0.024993752,0.024993752,0.074981255,0.024993752,0.099975006,0.024993752,0.024993752,0.099975006,0.024993752
1978,Meditations,Marcus Aurelius,stoicism,"And what a matter of either grief or wonder is this, if he that is unlearned, do the deeds of one that is unlearned?",170,and what matter of either grief or wonder is this if he that is unlearned do the deeds of one that is unlearned,23,0,0,0,0,0,0.043459365,0,0,0.043459365,0
