index,title,author,school,sentence_str,original_publication_date,sentences,word.count,anger,anticipation,disgust,fear,joy,sadness,surprise,trust,negative,positive
566,Meditations,Marcus Aurelius,stoicism,"And as for this, it proceeds from my neighbour, my kinsman, my fellow: through his ignorance indeed, because he knows not what is truly natural unto him: but I know it, and therefore carry myself towards him according to the natural law of fellowship; that is kindly, and justly.",170,and as for this it proceeds from my neighbour my kinsman my fellow through his ignorance indeed because he knows not what is truly natural unto him but know it and therefore carry myself towards him according to the natural law of fellowship that is kindly and justly,48,0,0,0,0,0,0,0,0.041657988,0.020828994,0.041657988
567,Meditations,Marcus Aurelius,stoicism,"As for those things that of themselves are altogether indifferent, as in my best judgment I conceive everything to deserve more or less, so I carry myself towards it.",170,as for those things that of themselves are altogether indifferent as in my best judgment conceive everything to deserve more or less so carry myself towards it,27,0.037023325,0.037023325,0,0,0,0,0.037023325,0.037023325,0,0.037023325
568,Meditations,Marcus Aurelius,stoicism,"If thou shalt intend that which is present, following the rule of right and reason carefully, solidly, meekly, and shalt not intermix any other businesses, but shall study this only to preserve thy spirit unpolluted, and pure, and shall cleave unto him without either hope or fear of anything, in all things that thou shalt either do or speak, contenting thyself with heroical truth, thou shalt live happily; and from this, there is no man that can hinder thee.",170,if thou shalt intend that which is present following the rule of right and reason carefully solidly meekly and shalt not intermix any other businesses but shall study this only to preserve thy spirit unpolluted and pure and shall cleave unto him without either hope or fear of anything in all things that thou shalt either do or speak contenting thyself with heroical truth thou shalt live happily and from this there is no man that can hinder thee,79,0.012656626,0.025313251,0,0.037969877,0.037969877,0,0.025313251,0.063283129,0.012656626,0.113909632
569,Meditations,Marcus Aurelius,stoicism,"As physicians and chirurgeons have always their instruments ready at hand for all sudden cures; so have thou always thy dogmata in a readiness for the knowledge of things, both divine and human: and whatsoever",170,as physicians and chirurgeons have always their instruments ready at hand for all sudden cures so have thou always thy dogmata in readiness for the knowledge of things both divine and human and whatsoever,34,0,0.058806233,0,0,0.029403117,0,0.029403117,0.029403117,0,0.058806233
570,Meditations,Marcus Aurelius,stoicism,"thou dost, even in the smallest things that thou dost, thou must ever remember that mutual relation, and connection that is between these two things divine, and things human.",170,thou dost even in the smallest things that thou dost thou must ever remember that mutual relation and connection that is between these two things divine and things human,29,0,0,0,0,0,0,0,0,0,0.034470872
571,Meditations,Marcus Aurelius,stoicism,"For without relation unto God, thou shalt never speed in any worldly actions; nor on the other side in any divine, without some respect had to things human.",170,for without relation unto god thou shalt never speed in any worldly actions nor on the other side in any divine without some respect had to things human,28,0,0.07140307,0,0.035701535,0.07140307,0,0,0.07140307,0,0.07140307
572,Meditations,Marcus Aurelius,stoicism,"Be not deceived; for thou shalt never live to read thy moral commentaries, nor the acts of the famous Romans and Grecians; nor those excerpta from several books; all which thou hadst provided and laid up for thyself against thine old age.",170,be not deceived for thou shalt never live to read thy moral commentaries nor the acts of the famous romans and grecians nor those excerpta from several books all which thou hadst provided and laid up for thyself against thine old age,42,0.047607712,0,0,0,0,0,0,0.023803856,0.023803856,0.047607712
573,Meditations,Marcus Aurelius,stoicism,"Hasten therefore to an end, and giving over all vain hopes, help thyself in time if thou carest for thyself, as thou oughtest to do.",170,hasten therefore to an end and giving over all vain hopes help thyself in time if thou carest for thyself as thou oughtest to do,25,0,0.039984006,0,0,0,0,0,0,0,0.039984006
574,Meditations,Marcus Aurelius,stoicism,"To steal, to sow, to buy, to be at rest, to see what is to be done (which is not seen by the eyes, but by another kind of sight:) what these words mean, and how many ways to be understood, they do not understand.",170,to steal to sow to buy to be at rest to see what is to be done which is not seen by the eyes but by another kind of sight what these words mean and how many ways to be understood they do not understand,45,0.04443457,0,0,0.022217285,0.022217285,0.022217285,0,0.022217285,0.04443457,0.04443457
575,Meditations,Marcus Aurelius,stoicism,"The body, the soul, the understanding.",170,the body the soul the understanding,6,0,0,0,0,0,0,0,0.166389351,0,0.166389351
576,Meditations,Marcus Aurelius,stoicism,"As the senses naturally belong to the body, and the desires and affections to the soul, so do the dogmata to the understanding.",170,as the senses naturally belong to the body and the desires and affections to the soul so do the dogmata to the understanding,23,0,0,0,0,0,0,0,0.043459365,0,0.043459365
577,Meditations,Marcus Aurelius,stoicism,"To be capable of fancies and imaginations, is common to man and beast.",170,to be capable of fancies and imaginations is common to man and beast,13,0.076863951,0,0,0.076863951,0,0,0,0,0.076863951,0
578,Meditations,Marcus Aurelius,stoicism,"To be violently drawn and moved by the lusts and desires of the soul, is proper to wild beasts and monsters, such as Phalaris and Nero were.",170,to be violently drawn and moved by the lusts and desires of the soul is proper to wild beasts and monsters such as phalaris and nero were,27,0.037023325,0,0.037023325,0.037023325,0,0.037023325,0.037023325,0,0.074046649,0.037023325
579,Meditations,Marcus Aurelius,stoicism,"To follow reason for ordinary duties and actions is common to them also, who believe not that there be any gods, and for their advantage would make no conscience to betray their own country; and who when once the doors be shut upon them, dare do anything.",170,to follow reason for ordinary duties and actions is common to them also who believe not that there be any gods and for their advantage would make no conscience to betray their own country and who when once the doors be shut upon them dare do anything,47,0.02127207,0.02127207,0.02127207,0,0,0.02127207,0.02127207,0.04254414,0.02127207,0.063816209
580,Meditations,Marcus Aurelius,stoicism,"If therefore all things else be common to these likewise, it follows, that for a man to like and embrace all things that happen and are destinated unto him, and not to trouble and molest that spirit which is seated in the temple of his own breast, with a multitude of vain fancies and imaginations, but to keep him propitious and to obey him as a god, never either speaking anything contrary to truth, or doing anything contrary to justice, is the only true property of a good man.",170,if therefore all things else be common to these likewise it follows that for man to like and embrace all things that happen and are destinated unto him and not to trouble and molest that spirit which is seated in the temple of his own breast with multitude of vain fancies and imaginations but to keep him propitious and to obey him as god never either speaking anything contrary to truth or doing anything contrary to justice is the only true property of good man,85,0,0.047053288,0,0.023526644,0.035289966,0,0.023526644,0.070579932,0.011763322,0.070579932
581,Meditations,Marcus Aurelius,stoicism,"And such a one, though no man should believe that he liveth as he doth, either sincerely and conscionably, or cheerful and contentedly; yet is he neither with any man at all angry for it, nor diverted by it from the way that leadeth to the end of his life, through which a man must pass pure, ever ready to depart, and willing of himself without any compulsion to fit and accommodate himself to his proper lot and portion.",170,and such one though no man should believe that he liveth as he doth either sincerely and conscionably or cheerful and contentedly yet is he neither with any man at all angry for it nor diverted by it from the way that leadeth to the end of his life through which man must pass pure ever ready to depart and willing of himself without any compulsion to fit and accommodate himself to his proper lot and portion,77,0.025970653,0.025970653,0.012985327,0,0.012985327,0.012985327,0.012985327,0,0.025970653,0.025970653
582,Meditations,Marcus Aurelius,stoicism,"That inward mistress part of man if it be in its own true natural temper, is towards all worldly chances and events ever so disposed and affected, that it will easily turn and apply itself to that which may be, and is within its own power to compass, when that cannot be which at first it intended.",170,that inward mistress part of man if it be in its own true natural temper is towards all worldly chances and events ever so disposed and affected that it will easily turn and apply itself to that which may be and is within its own power to compass when that cannot be which at first it intended,57,0.017540782,0.035081565,0.017540782,0,0,0,0,0.035081565,0.017540782,0.035081565
583,Meditations,Marcus Aurelius,stoicism,"For it never doth absolutely addict and apply itself to any one object, but whatsoever it is that it doth now intend and prosecute, it doth prosecute it with exception and reservation;",170,for it never doth absolutely addict and apply itself to any one object but whatsoever it is that it doth now intend and prosecute it doth prosecute it with exception and reservation,32,0.031240237,0,0,0.031240237,0,0.031240237,0,0.031240237,0.031240237,0
584,Meditations,Marcus Aurelius,stoicism,"so that whatsoever it is that falls out contrary to its first intentions, even that afterwards it makes its proper object.",170,so that whatsoever it is that falls out contrary to its first intentions even that afterwards it makes its proper object,21,0,0,0,0,0,0,0,0,0.047596383,0.047596383
585,Meditations,Marcus Aurelius,stoicism,"Even as the fire when it prevails upon those things that are in his way; by which things indeed a little fire would have been quenched, but a great fire doth soon turn to its own nature, and so consume whatsoever comes in his way:",170,even as the fire when it prevails upon those things that are in his way by which things indeed little fire would have been quenched but great fire doth soon turn to its own nature and so consume whatsoever comes in his way,43,0,0,0,0.023250407,0,0,0,0,0,0
586,Meditations,Marcus Aurelius,stoicism,yea by those very things it is made greater and greater.,170,yea by those very things it is made greater and greater,11,0,0,0,0,0,0,0,0,0,0.090826521
587,Meditations,Marcus Aurelius,stoicism,"Let nothing be done rashly, and at random, but all things according to the most exact and perfect rules of art.",170,let nothing be done rashly and at random but all things according to the most exact and perfect rules of art,21,0,0.095192765,0,0,0.095192765,0.047596383,0.047596383,0.047596383,0,0.095192765
588,Meditations,Marcus Aurelius,stoicism,"They seek for themselves private retiring places, as country villages, the sea shore, mountains; yea thou thyself art wont to long much after such places.",170,they seek for themselves private retiring places as country villages the sea shore mountains yea thou thyself art wont to long much after such places,25,0,0.159936026,0,0,0.039984006,0.039984006,0.039984006,0,0,0.079968013
589,Meditations,Marcus Aurelius,stoicism,But all this thou must know proceeds from simplicity in the highest degree.,170,but all this thou must know proceeds from simplicity in the highest degree,13,0,0.076863951,0,0.076863951,0.076863951,0,0.076863951,0,0.076863951,0.153727902
590,Meditations,Marcus Aurelius,stoicism,"At what time soever thou wilt, it is in thy power to retire into thyself, and to be at rest, and free from all businesses.",170,at what time soever thou wilt it is in thy power to retire into thyself and to be at rest and free from all businesses,25,0,0.039984006,0,0,0,0,0,0,0,0.039984006
591,Meditations,Marcus Aurelius,stoicism,"A man cannot any whither retire better than to his own soul; he especially who is beforehand provided of such things within, which whensoever he doth withdraw himself to look in, may presently afford unto him perfect ease and tranquillity.",170,man cannot any whither retire better than to his own soul he especially who is beforehand provided of such things within which whensoever he doth withdraw himself to look in may presently afford unto him perfect ease and tranquillity,39,0,0.025634453,0,0,0.025634453,0.025634453,0,0.025634453,0.025634453,0.076903358
592,Meditations,Marcus Aurelius,stoicism,"By tranquillity I understand a decent orderly disposition and carriage, free from all confusion and tumultuousness.",170,by tranquillity understand decent orderly disposition and carriage free from all confusion and tumultuousness,14,0.071377587,0,0,0.071377587,0,0,0,0,0.071377587,0.142755175
593,Meditations,Marcus Aurelius,stoicism,"Afford then thyself this retiring continually, and thereby refresh and renew thyself.",170,afford then thyself this retiring continually and thereby refresh and renew thyself,12,0,0,0,0,0,0,0,0,0,0.083263947
594,Meditations,Marcus Aurelius,stoicism,"Let these precepts be brief and fundamental, which as soon as thou dost call them to mind, may suffice thee to purge thy soul throughly, and to send thee away well pleased with those things whatsoever they be, which now again after this short withdrawing of thy soul into herself thou dost return unto.",170,let these precepts be brief and fundamental which as soon as thou dost call them to mind may suffice thee to purge thy soul throughly and to send thee away well pleased with those things whatsoever they be which now again after this short withdrawing of thy soul into herself thou dost return unto,54,0,0,0,0.01851509,0.01851509,0,0,0.01851509,0.01851509,0.03703018
595,Meditations,Marcus Aurelius,stoicism,For what is it that thou art offended at?,170,for what is it that thou art offended at,9,0.110987791,0.110987791,0,0,0.110987791,0.221975583,0.110987791,0,0.110987791,0.110987791
596,Meditations,Marcus Aurelius,stoicism,"Can it be at the wickedness of men, when thou dost call to mind this conclusion, that all reasonable creatures are made one for another?",170,can it be at the wickedness of men when thou dost call to mind this conclusion that all reasonable creatures are made one for another,25,0,0,0.039984006,0,0,0,0,0,0.039984006,0
597,Meditations,Marcus Aurelius,stoicism,and that it is part of justice to bear with them?,170,and that it is part of justice to bear with them,11,0.090826521,0,0,0.090826521,0,0,0,0.090826521,0,0.090826521
598,Meditations,Marcus Aurelius,stoicism,and that it is against their wills that they offend?,170,and that it is against their wills that they offend,10,0.0999001,0,0.0999001,0,0,0,0,0,0.0999001,0
599,Meditations,Marcus Aurelius,stoicism,"and how many already, who once likewise prosecuted their enmities, suspected, hated, and fiercely contended, are now long ago stretched out, and reduced unto ashes?",170,and how many already who once likewise prosecuted their enmities suspected hated and fiercely contended are now long ago stretched out and reduced unto ashes,25,0,0.039984006,0,0,0,0.039984006,0,0,0.039984006,0
600,Meditations,Marcus Aurelius,stoicism,It is time for thee to make an end.,170,it is time for thee to make an end,9,0,0.110987791,0,0,0,0,0,0,0,0
601,Meditations,Marcus Aurelius,stoicism,"As for those things which among the common chances of the world happen unto thee as thy particular lot and portion, canst thou be displeased with any of them, when thou dost call that our ordinary dilemma to mind, either a providence, or Democritus his atoms; and with it, whatsoever we brought to prove that the whole world is as it were one city?",170,as for those things which among the common chances of the world happen unto thee as thy particular lot and portion canst thou be displeased with any of them when thou dost call that our ordinary dilemma to mind either providence or democritus his atoms and with it whatsoever we brought to prove that the whole world is as it were one city,63,0.015870497,0.015870497,0.015870497,0.015870497,0,0.015870497,0,0,0.015870497,0.015870497
602,Meditations,Marcus Aurelius,stoicism,"And as for thy body, what canst thou fear, if thou dost consider that thy mind and understanding, when once it hath recollected itself, and knows its own power, hath in this life and breath (whether it run smoothly and gently, or whether harshly and rudely),",170,and as for thy body what canst thou fear if thou dost consider that thy mind and understanding when once it hath recollected itself and knows its own power hath in this life and breath whether it run smoothly and gently or whether harshly and rudely,46,0.021734406,0,0,0.021734406,0,0,0,0.021734406,0.021734406,0.021734406
603,Meditations,Marcus Aurelius,stoicism,"no interest at all, but is altogether indifferent: and whatsoever else",170,no interest at all but is altogether indifferent and whatsoever else,11,0,0,0,0,0,0,0,0,0,0.090826521
604,Meditations,Marcus Aurelius,stoicism,hast heard and assented unto concerning either pain or pleasure?,170,hast heard and assented unto concerning either pain or pleasure,10,0,0,0,0.0999001,0,0.0999001,0,0,0.0999001,0
605,Meditations,Marcus Aurelius,stoicism,But the care of thine honour and reputation will perchance distract thee?,170,but the care of thine honour and reputation will perchance distract thee,12,0,0,0,0,0,0,0.083263947,0,0.083263947,0
606,Meditations,Marcus Aurelius,stoicism,"How can that be, if thou dost look back, and consider both how quickly all things that are, are forgotten, and what an immense chaos of eternity was before, and will follow after all things: and the vanity of praise, and the inconstancy and variableness of human judgments and opinions, and the narrowness of the place, wherein it is limited and circumscribed?",170,how can that be if thou dost look back and consider both how quickly all things that are are forgotten and what an immense chaos of eternity was before and will follow after all things and the vanity of praise and the inconstancy and variableness of human judgments and opinions and the narrowness of the place wherein it is limited and circumscribed,62,0.032252862,0,0,0.032252862,0.016126431,0.048379294,0,0.016126431,0.064505725,0.032252862
607,Meditations,Marcus Aurelius,stoicism,"For the whole earth is but as one point; and of it, this inhabited part of it, is but a very little part; and of this part, how many in number, and what manner of men are they, that will commend thee?",170,for the whole earth is but as one point and of it this inhabited part of it is but very little part and of this part how many in number and what manner of men are they that will commend thee,41,0,0,0,0,0,0,0,0,0,0.024384297
608,Meditations,Marcus Aurelius,stoicism,"What remains then, but that thou often put in practice this kind of retiring of thyself, to this little part of thyself; and above all things, keep thyself from distraction, and intend not anything vehemently, but be free and consider all things, as a man whose proper object is Virtue, as a man whose true nature is to be kind and sociable, as a citizen, as a mortal creature.",170,what remains then but that thou often put in practice this kind of retiring of thyself to this little part of thyself and above all things keep thyself from distraction and intend not anything vehemently but be free and consider all things as man whose proper object is virtue as man whose true nature is to be kind and sociable as citizen as mortal creature,65,0,0,0.030764498,0.030764498,0.015382249,0,0,0.061528996,0.061528996,0.107675742
609,Meditations,Marcus Aurelius,stoicism,"Among other things, which to consider, and look into thou must use to withdraw thyself, let those two be among the most obvious and at hand.",170,among other things which to consider and look into thou must use to withdraw thyself let those two be among the most obvious and at hand,26,0,0,0,0,0,0.038446751,0,0.038446751,0.038446751,0.038446751
610,Meditations,Marcus Aurelius,stoicism,"One, that the things or objects themselves reach not unto the soul, but stand without still and quiet, and that it is from the opinion only which is within, that all the tumult and all the trouble doth proceed.",170,one that the things or objects themselves reach not unto the soul but stand without still and quiet and that it is from the opinion only which is within that all the tumult and all the trouble doth proceed,39,0.025634453,0,0,0.025634453,0,0.025634453,0.025634453,0,0.025634453,0.025634453
611,Meditations,Marcus Aurelius,stoicism,"The next, that all these things, which now thou seest, shall within a very little while be changed, and be no more: and ever call to mind, how many changes and alterations in the world thou thyself hast already been an eyewitness of in thy time.",170,the next that all these things which now thou seest shall within very little while be changed and be no more and ever call to mind how many changes and alterations in the world thou thyself hast already been an eyewitness of in thy time,45,0,0.022217285,0,0,0,0,0,0.022217285,0,0
612,Meditations,Marcus Aurelius,stoicism,"This world is mere change, and this life, opinion.",170,this world is mere change and this life opinion,9,0,0,0,0.110987791,0,0,0,0,0,0
613,Meditations,Marcus Aurelius,stoicism,"If to understand and to be reasonable be common unto all men, then is that reason, for which we are termed reasonable, common unto all.",170,if to understand and to be reasonable be common unto all men then is that reason for which we are termed reasonable common unto all,25,0,0,0,0,0,0,0,0,0,0.039984006
614,Meditations,Marcus Aurelius,stoicism,"If reason is general, then is that reason also, which prescribeth what is to be done and what not, common unto all.",170,if reason is general then is that reason also which prescribeth what is to be done and what not common unto all,22,0,0,0,0,0,0,0,0.045433894,0,0.090867787
615,Meditations,Marcus Aurelius,stoicism,"If law, then are we fellow citizens.",170,if law then are we fellow citizens,7,0,0,0,0,0,0,0,0.285306705,0,0.142653352
616,Meditations,Marcus Aurelius,stoicism,"If so, then are we partners in some one commonweal.",170,if so then are we partners in some one commonweal,10,0,0,0,0,0,0,0,0,0,0
617,Meditations,Marcus Aurelius,stoicism,"If so, then the world is as it were a city.",170,if so then the world is as it were city,10,0,0,0,0,0,0,0,0,0,0
618,Meditations,Marcus Aurelius,stoicism,"For which other commonweal is it, that all men can be said to be members of?",170,for which other commonweal is it that all men can be said to be members of,16,0,0,0,0,0,0,0,0,0,0
619,Meditations,Marcus Aurelius,stoicism,"From this common city it is, that understanding, reason, and law is derived unto us, for from whence else?",170,from this common city it is that understanding reason and law is derived unto us for from whence else,19,0,0,0,0,0,0,0,0.105207785,0,0.105207785
620,Meditations,Marcus Aurelius,stoicism,For as that which in me is earthly,170,for as that which in me is earthly,8,0,0,0,0,0,0,0,0,0,0
621,Meditations,Marcus Aurelius,stoicism,I have from some common earth; and that which is moist from some other element is imparted; as my breath and life hath its proper fountain; and that likewise which is dry and fiery in me: (for there is nothing which doth not proceed from something,170,have from some common earth and that which is moist from some other element is imparted as my breath and life hath its proper fountain and that likewise which is dry and fiery in me for there is nothing which doth not proceed from something,45,0,0,0,0,0,0,0,0,0,0.022217285
622,Meditations,Marcus Aurelius,stoicism,; as also there is nothing that can be reduced unto mere nothing:),170,as also there is nothing that can be reduced unto mere nothing,12,0,0,0,0,0,0,0,0,0,0
623,Meditations,Marcus Aurelius,stoicism,so also is there some common beginning from whence,170,so also is there some common beginning from whence,9,0,0,0,0,0,0,0,0,0,0
624,Meditations,Marcus Aurelius,stoicism,my understanding hath proceeded.,170,my understanding hath proceeded,4,0,0,0,0,0,0,0,0.249376559,0,0.249376559
